{
  "$schema": "https://json-schema.org/draft/2020-12/schema",
  "$id": "predit://artifacts/edit_decisions",
  "type": "object",
  "additionalProperties": false,
  "properties": {
    "cuts": {
      "type": "array",
      "items": {
        "$schema": "https://json-schema.org/draft/2020-12/schema",
        "$id": "predit://artifacts/edit_decisions.cut",
        "type": "object",
        "additionalProperties": false,
        "properties": {
          "start_s": {
            "type": "number",
            "minimum": 0
          },
          "end_s": {
            "type": "number",
            "minimum": 0
          },
          "timing_anchor": {
            "type": "string"
          },
          "timing_source": {
            "type": "string",
            "enum": [
              "lyric",
              "word",
              "beat",
              "section",
              "climax",
              "manual",
              "audio_energy"
            ]
          },
          "timing_ref": {
            "$schema": "https://json-schema.org/draft/2020-12/schema",
            "$id": "predit://artifacts/timing_ref",
            "type": "object",
            "additionalProperties": false,
            "properties": {
              "lyric_line_id": {
                "type": "string"
              },
              "word_id": {
                "type": "string"
              },
              "beat_index": {
                "type": "integer",
                "minimum": 0
              },
              "climax_index": {
                "type": "integer",
                "minimum": 0
              }
            },
            "required": []
          },
          "start_ms": {
            "type": "integer",
            "minimum": 0
          },
          "end_ms": {
            "type": "integer",
            "minimum": 0
          },
          "asset_id": {
            "type": "string"
          },
          "transition_in": {
            "type": "string"
          },
          "transition_out": {
            "type": "string"
          },
          "provider": {
            "type": "string"
          }
        },
        "required": [
          "start_s",
          "end_s",
          "asset_id"
        ]
      }
    },
    "overlays": {
      "type": "array",
      "items": {}
    },
    "subtitles": {
      "$schema": "https://json-schema.org/draft/2020-12/schema",
      "$id": "predit://artifacts/edit_decisions.subtitles",
      "type": "object",
      "additionalProperties": false,
      "properties": {
        "enabled": {
          "type": "boolean"
        },
        "source": {
          "type": "string"
        }
      },
      "required": []
    },
    "audio": {
      "type": "object",
      "additionalProperties": true
    },
    "music": {},
    "transitions": {
      "type": "array",
      "items": {}
    },
    "render_runtime": {
      "type": "string",
      "enum": [
        "ffmpeg",
        "remotion",
        "hyperframes"
      ]
    },
    "renderer_family": {
      "type": "string",
      "enum": [
        "explainer-data",
        "explainer-teacher",
        "cinematic-trailer",
        "documentary-montage",
        "product-reveal",
        "screen-demo",
        "presenter",
        "animation-first"
      ]
    },
    "brand": {
      "$schema": "https://json-schema.org/draft/2020-12/schema",
      "$id": "predit://artifacts/edit_decisions.brand",
      "type": "object",
      "additionalProperties": false,
      "properties": {
        "slug": {
          "type": "string"
        },
        "name": {
          "type": "string"
        }
      },
      "required": [
        "slug",
        "name"
      ]
    }
  },
  "required": [
    "cuts",
    "render_runtime",
    "renderer_family"
  ]
}
