{
  "cuts": [
    {
      "start_s": 0,
      "end_s": 5,
      "timing_anchor": "line-1",
      "timing_source": "lyric",
      "timing_ref": {
        "lyric_line_id": "line-1",
        "beat_index": 0
      },
      "start_ms": 0,
      "end_ms": 5000,
      "asset_id": "asset-1",
      "transition_in": "cut",
      "transition_out": "fade",
      "provider": "fixture"
    }
  ],
  "overlays": [],
  "subtitles": {
    "enabled": true,
    "source": "captions.srt"
  },
  "audio": {
    "music": {
      "track_path": "music_library/fixture.wav",
      "ducking": {
        "enabled": true,
        "threshold_db": -18,
        "reduction_db": -6,
        "attack_ms": 20,
        "release_ms": 100
      }
    }
  },
  "render_runtime": "ffmpeg",
  "renderer_family": "explainer-data",
  "brand": {
    "slug": "fixture",
    "name": "Fixture"
  }
}
